[
  {
    "designation": "ITM-UM04-S01-N001-001-R0",
    "name": "Excalibur, the drawn blade",
    "status": "active",
    "function": "Generatable item pattern (excalibur).",
    "label": "excalibur",
    "file": "catalog/items.yaml",
    "type": "ITM",
    "domain": "UM04",
    "sector": "S01",
    "node": "N001",
    "sequence": "001",
    "revision": "R0",
    "docs": "",
    "tests": "tests/test_generate.py",
    "depends_on": [],
    "related": [],
    "reuse": "any seed's @sg item generator",
    "tags": [
      "item",
      "pattern"
    ],
    "notes": "",
    "superseded_by": "",
    "aliases": [],
    "created": "2026-07-09",
    "updated": "2026-07-09"
  },
  {
    "designation": "ITM-UM04-S01-N001-002-R0",
    "name": "an iron sword",
    "status": "active",
    "function": "Generatable item pattern (iron_sword).",
    "label": "iron_sword",
    "file": "catalog/items.yaml",
    "type": "ITM",
    "domain": "UM04",
    "sector": "S01",
    "node": "N001",
    "sequence": "002",
    "revision": "R0",
    "docs": "",
    "tests": "tests/test_generate.py",
    "depends_on": [],
    "related": [],
    "reuse": "any seed's @sg item generator",
    "tags": [
      "item",
      "pattern"
    ],
    "notes": "",
    "superseded_by": "",
    "aliases": [],
    "created": "2026-07-09",
    "updated": "2026-07-09"
  },
  {
    "designation": "ITM-UM04-S01-N001-003-R0",
    "name": "an oaken shield",
    "status": "active",
    "function": "Generatable item pattern (oaken_shield).",
    "label": "oaken_shield",
    "file": "catalog/items.yaml",
    "type": "ITM",
    "domain": "UM04",
    "sector": "S01",
    "node": "N001",
    "sequence": "003",
    "revision": "R0",
    "docs": "",
    "tests": "tests/test_generate.py",
    "depends_on": [],
    "related": [],
    "reuse": "any seed's @sg item generator",
    "tags": [
      "item",
      "pattern"
    ],
    "notes": "",
    "superseded_by": "",
    "aliases": [],
    "created": "2026-07-09",
    "updated": "2026-07-09"
  }
]